{
  "schema_version": "research-ancestry-graph-v3-1",
  "model": {
    "id": "v3-autonomous-first-directed-root-compressive-stance",
    "physical_parameter": [
      10,
      10,
      20,
      20,
      1,
      1,
      0,
      0,
      2,
      0.5
    ],
    "parameter_policy": "v2-exact",
    "state_schema_version": "quadruped-state-v3.1",
    "parameter_schema_version": "quadruped-parameter-v3.1"
  },
  "domain": {
    "energy": [
      1.0001,
      3.0
    ],
    "mean_speed": [
      -3,
      3
    ],
    "pitch_abs_max": 1.2,
    "primitive_period_max": 12,
    "event_count_max": 64,
    "contact_law": "first eligible descending TD, ascending LO, no tensile stance",
    "targets": [
      "PIP",
      "PK",
      "BD",
      "HB_front",
      "HB_hind",
      "GP",
      "B2",
      "F2",
      "H2",
      "G2",
      "PC",
      "TR",
      "TL"
    ],
    "equivalences": [
      "horizontal translation",
      "time phase",
      "proven fixed-parameter leg symmetries"
    ],
    "connectivity": "regular bifurcation network; nonsmooth connections recorded separately"
  },
  "source_snapshots": [
    {
      "path": "Research_v3/runs/full/inventory.json",
      "exists": true,
      "sha256": "c415d47ee9c140d6e9bfe048fdddcb22cfbbf864c9ef6ac7d228db64e35f6b33",
      "status": "completed",
      "finished_utc": "07-Oct-2026 09:21:54"
    },
    {
      "path": "Research_v3/runs/full/compatibility.json",
      "exists": true,
      "sha256": "b09c927a99795f32130ca1e7753f8517f45d3890f37f8814a24472355635cc92",
      "status": "completed",
      "finished_utc": "07-Oct-2026 09:52:16"
    },
    {
      "path": "Research_v3/runs/full/vertical.json",
      "exists": true,
      "sha256": "6da37de8eaeb2016c033269b8e9aefc5a392227f9ee23d81222b43671f2ff4d7",
      "status": "completed",
      "finished_utc": "07-Oct-2026 09:25:49"
    },
    {
      "path": "Research_v3/runs/full/fixed_family.json",
      "exists": true,
      "sha256": "271670106bd7b564876cef5a7470c3ac7ce4d60b5dd094bbeec5bf50cba313b5",
      "status": "completed",
      "finished_utc": "07-Oct-2026 10:06:12"
    },
    {
      "path": "Research_v3/runs/full/parent_only.json",
      "exists": true,
      "sha256": "9a3dffa789b8346950bad0dd8638684a053aa5affec9399e5c415fd05facfc9e",
      "status": "completed_bounded_search",
      "finished_utc": "07-Oct-2026 09:44:11"
    },
    {
      "path": "Research_v3/runs/full/pip_pk_local.json",
      "exists": true,
      "sha256": "9ca7c10aefaa7675fc16400de4a38103d254ea13fede2d2a6320e3d81aafe1c7",
      "status": "budget_exhausted",
      "finished_utc": null
    },
    {
      "path": "Research_v3/runs/full/floquet.json",
      "exists": true,
      "sha256": "06a443ab86f0727f3dd13acc2c6e6c1f40178c15ec0069cb1a15dbbfeef523a2",
      "status": "completed",
      "finished_utc": "07-Oct-2026 09:44:57"
    },
    {
      "path": "Research_v3/runs/full/solution_index.json",
      "exists": true,
      "sha256": "b5343aed1230dbe887cc9b7d65e19ab7018e94c66b9b957c15cbfc2531b8740d",
      "status": "completed_validation",
      "finished_utc": null
    }
  ],
  "nodes": [
    {
      "id": "root-PIP",
      "label": "ordinary vertical PIP root",
      "origin": "parent_only",
      "status": "numerical_root_benchmarks",
      "model": {
        "id": "v3-autonomous-first-directed-root-compressive-stance",
        "physical_parameter": [
          10,
          10,
          20,
          20,
          1,
          1,
          0,
          0,
          2,
          0.5
        ],
        "parameter_policy": "v2-exact",
        "state_schema_version": "quadruped-state-v3.1",
        "parameter_schema_version": "quadruped-parameter-v3.1"
      },
      "restricted": true,
      "solution_ids": [
        "root-vertical-01",
        "root-vertical-02",
        "root-vertical-03",
        "root-vertical-04",
        "root-vertical-05",
        "root-vertical-06",
        "root-vertical-07",
        "root-vertical-08",
        "root-vertical-09",
        "root-vertical-10",
        "root-vertical-11",
        "root-vertical-12"
      ],
      "notes": "Synchrony is an invariant restriction, not a full contact-cluster derivative certificate."
    },
    {
      "id": "P1-PK",
      "label": "P1 traveling-pronking family",
      "origin": "hypothesis",
      "status": "unresolved",
      "model": {
        "id": "v3-autonomous-first-directed-root-compressive-stance",
        "physical_parameter": [
          10,
          10,
          20,
          20,
          1,
          1,
          0,
          0,
          2,
          0.5
        ],
        "parameter_policy": "v2-exact",
        "state_schema_version": "quadruped-state-v3.1",
        "parameter_schema_version": "quadruped-parameter-v3.1"
      },
      "restricted": false,
      "solution_ids": [],
      "notes": "Target/history name only; does not prescribe dynamics, isotropy or measured flight count."
    },
    {
      "id": "P1-BD",
      "label": "P1 bounding",
      "origin": "hypothesis",
      "status": "unresolved",
      "model": {
        "id": "v3-autonomous-first-directed-root-compressive-stance",
        "physical_parameter": [
          10,
          10,
          20,
          20,
          1,
          1,
          0,
          0,
          2,
          0.5
        ],
        "parameter_policy": "v2-exact",
        "state_schema_version": "quadruped-state-v3.1",
        "parameter_schema_version": "quadruped-parameter-v3.1"
      },
      "restricted": false,
      "solution_ids": [],
      "notes": "Target/history name only; does not prescribe dynamics, isotropy or measured flight count."
    },
    {
      "id": "P1-HB-front",
      "label": "P1 front-spread half-bound",
      "origin": "hypothesis",
      "status": "unresolved",
      "model": {
        "id": "v3-autonomous-first-directed-root-compressive-stance",
        "physical_parameter": [
          10,
          10,
          20,
          20,
          1,
          1,
          0,
          0,
          2,
          0.5
        ],
        "parameter_policy": "v2-exact",
        "state_schema_version": "quadruped-state-v3.1",
        "parameter_schema_version": "quadruped-parameter-v3.1"
      },
      "restricted": false,
      "solution_ids": [],
      "notes": "Target/history name only; does not prescribe dynamics, isotropy or measured flight count."
    },
    {
      "id": "P1-HB-hind",
      "label": "P1 hind-spread half-bound",
      "origin": "hypothesis",
      "status": "unresolved",
      "model": {
        "id": "v3-autonomous-first-directed-root-compressive-stance",
        "physical_parameter": [
          10,
          10,
          20,
          20,
          1,
          1,
          0,
          0,
          2,
          0.5
        ],
        "parameter_policy": "v2-exact",
        "state_schema_version": "quadruped-state-v3.1",
        "parameter_schema_version": "quadruped-parameter-v3.1"
      },
      "restricted": false,
      "solution_ids": [],
      "notes": "Target/history name only; does not prescribe dynamics, isotropy or measured flight count."
    },
    {
      "id": "P1-GP",
      "label": "P1 galloping",
      "origin": "hypothesis",
      "status": "unresolved",
      "model": {
        "id": "v3-autonomous-first-directed-root-compressive-stance",
        "physical_parameter": [
          10,
          10,
          20,
          20,
          1,
          1,
          0,
          0,
          2,
          0.5
        ],
        "parameter_policy": "v2-exact",
        "state_schema_version": "quadruped-state-v3.1",
        "parameter_schema_version": "quadruped-parameter-v3.1"
      },
      "restricted": false,
      "solution_ids": [],
      "notes": "Target/history name only; does not prescribe dynamics, isotropy or measured flight count."
    },
    {
      "id": "P2-B2",
      "label": "P2 B2 component",
      "origin": "hypothesis",
      "status": "unresolved",
      "model": {
        "id": "v3-autonomous-first-directed-root-compressive-stance",
        "physical_parameter": [
          10,
          10,
          20,
          20,
          1,
          1,
          0,
          0,
          2,
          0.5
        ],
        "parameter_policy": "v2-exact",
        "state_schema_version": "quadruped-state-v3.1",
        "parameter_schema_version": "quadruped-parameter-v3.1"
      },
      "restricted": false,
      "solution_ids": [],
      "notes": "Target/history name only; does not prescribe dynamics, isotropy or measured flight count."
    },
    {
      "id": "P2-F2",
      "label": "P2 front-spread two-flight target",
      "origin": "hypothesis",
      "status": "unresolved",
      "model": {
        "id": "v3-autonomous-first-directed-root-compressive-stance",
        "physical_parameter": [
          10,
          10,
          20,
          20,
          1,
          1,
          0,
          0,
          2,
          0.5
        ],
        "parameter_policy": "v2-exact",
        "state_schema_version": "quadruped-state-v3.1",
        "parameter_schema_version": "quadruped-parameter-v3.1"
      },
      "restricted": false,
      "solution_ids": [],
      "notes": "Target/history name only; does not prescribe dynamics, isotropy or measured flight count."
    },
    {
      "id": "P2-H2",
      "label": "P2 hind-spread two-flight target",
      "origin": "hypothesis",
      "status": "unresolved",
      "model": {
        "id": "v3-autonomous-first-directed-root-compressive-stance",
        "physical_parameter": [
          10,
          10,
          20,
          20,
          1,
          1,
          0,
          0,
          2,
          0.5
        ],
        "parameter_policy": "v2-exact",
        "state_schema_version": "quadruped-state-v3.1",
        "parameter_schema_version": "quadruped-parameter-v3.1"
      },
      "restricted": false,
      "solution_ids": [],